"label","nl-BE","es","en","fr","zh","ru","th","tr","id"
"login_go","Verstuur","Ir","Go","Lancer","登入","ходите","GOOOO","Giriş","Lanjutkan"
"login_invalid_username_and_password","Ongeldige gebruiker/paswoord","Usuario/Contraseña inválidos","Invalid username/password","Entrée invalide","錯誤的帳號或密碼","Неправелная Имя/Пароль","ชื่อผู้ใช้/รหัส ไม่ถูกต้อง","Kullanıcı adı/Şifre yanlış","Nama Pengguna/Kata Kunci Salah"
"login_login","Login","Iniciar Sesión","Login","Login","登入","Вход","ลงชื่อเข้าใช้","Giriş","Masuk"
"login_password","Paswoord","Contraseña","Password","Mot de passe","密碼","Пароль","รหัสผ่าน","Şifre","Kata kunci"
"login_username","Gebruiker","Usuario","Username","Nom d\'utilisateur","帳號","Имя","ชื่อผู้ใช้","Kullanıcı Adı","Nama Anda"
"login_welcome_message","Welkom in deze module. Voer gebruikersnaam en paswoord in om verder te gaan.","Bienvenido(a) al Sistema Open Source Point of Sale. Para continuar, inicia sesión usando tu Usuario y Contraseña.","Welcome to the Open Source Point of Sale System. To continue, please login using your username and password below.","Bienvenue au Système Open Source Point of Sale. Pour continuer, veuiller entrer votre nom d\'utilisateur et votre mot de passe ci-dessous.","歡迎使用Master6進銷存。若要繼續，請使用您的帳號和密碼登錄。","Добро пожаловать в Open Source Point of Sale. Чтобы продолжить, пожалуйста войдите на сайт, используя имя и пароль.","ยินดีต้องรับสู่ระบบ Open Source Point of Sale. เพื่อที่จะไปต่อ, กรุณาเข้าสู่ระบบโดยใส่ ชื่อผู้ใช้ และ รหัสผ่านที่อยู่ด้านล่าง.","Syolcu POS\'a hoşgeldiniz.","SELAMAT DATANG. Silahkan login untuk masuk aplikasi, Isikan Nama Pengguna dan Kata Kunci Anda di bawah ini."
